{
  "schema_version": 1,
  "run_id": "20260712T075928Z-f5a4ec36",
  "experiment_id": "linear-demo",
  "status": "succeeded",
  "started_at": "2026-07-12T07:59:28.782314+00:00",
  "ended_at": "2026-07-12T07:59:28.831209+00:00",
  "duration_seconds": 0.054792,
  "command": [
    "C:\\Users\\asus\\AppData\\Local\\Programs\\Python\\Python313\\python.exe",
    "src/run.py"
  ],
  "exit_code": 0,
  "git_revision": "0ef1f0c64481c699bfb2d227fadf5b7b0f138654",
  "manifest_sha256": "f8b003c05f58a30f533258af993b7a6576157b0d35583ccf69f588aac4c82e98",
  "environment_sha256": "3a4c6e2f419b26647794fb5b82f6f1d47e90e9052bfd7a920d9fac691c1b99a1",
  "inputs": [
    {
      "path": "data/raw/points.csv",
      "exists": true,
      "sha256": "ae91c9cff27f1c5976c2c46b33cfb9954f4a7cfbf8a8c67943d7b36b8310383a",
      "bytes": 21,
      "kind": "file"
    }
  ],
  "artifacts": [
    {
      "path": "artifacts/results.json",
      "exists": true,
      "sha256": "ff49a4c74d032464a351d7693c9714d960888662635b532658bf483cbde27328",
      "bytes": 155,
      "kind": "file"
    },
    {
      "path": "artifacts/fit.svg",
      "exists": true,
      "sha256": "30f1bdc4e2c0c9b608850915598e0521c71462a30a856ffdd637b41f35876ee3",
      "bytes": 598,
      "kind": "file"
    }
  ]
}
